[
  {
    "id": "RUST-OPT-001",
    "title": "Pre-allocate Vec capacity to avoid incremental reallocation",
    "impact_level": "MEDIUM",
    "category": "Collections",
    "description": "A Vec built by repeated push() in a loop of known/estimable length reallocates and memcpys its buffer O(log n) times as it grows. Reserving capacity up front turns that into a single allocation.",
    "trigger_condition": {
      "ast_node_types": ["let_declaration", "call_expression"],
      "anti_pattern_regex": "let\\s+mut\\s+\\w+\\s*=\\s*Vec::new\\(\\);",
      "explanation": "Flag a `Vec::new()` (or `vec![]`) bound to a mutable binding that is subsequently grown with push() inside a loop whose iteration count is derivable from a slice/iterator length."
    },
    "remediation": {
      "before_code": "let mut out = Vec::new();\nfor x in &items {\n    out.push(transform(x));\n}",
      "after_code": "let mut out = Vec::with_capacity(items.len());\nfor x in &items {\n    out.push(transform(x));\n}",
      "dependencies": []
    },
    "references": [
      {
        "title": "The Rust Performance Book — Heap Allocations",
        "url": "https://nnethercote.github.io/perf-book/heap-allocations.html"
      }
    ]
  }
]
